{
  "schemaVersion": "2",
  "packageId": "asr",
  "version": "0.0.0",
  "status": "draft",
  "source": {
    "repoId": "k2-fsa/sherpa-onnx",
    "revision": null,
    "upstreamModelId": "Qwen/Qwen3-ASR-0.6B",
    "licenseSource": "Upstream model Apache-2.0 (QwenLM/Qwen3-ASR); export repo carries no explicit LICENSE",
    "archive": {
      "url": "https://github.com/k2-fsa/sherpa-onnx/releases/download/asr-models/sherpa-onnx-qwen3-asr-0.6B-int8-2026-03-25.tar.bz2",
      "sha256": "393f8a14e2f5fb96746aaab342997a40641001fbd5bf9592a080a8329178ee96",
      "sizeBytes": 878702423,
      "stripPrefix": "sherpa-onnx-qwen3-asr-0.6B-int8-2026-03-25"
    }
  },
  "runtime": {
    "backend": "onnx",
    "apiContractVersion": "1",
    "quantization": "int8",
    "runtimeRevision": "sherpa-onnx v1.13.7 (tag 917bed95c8e5c7c18aa4d69fea42e9ef8ef0a60e; host wheel sherpa_onnx-1.13.7, Android jniLibs v1.13.7)",
    "executionProviders": [
      "cpu"
    ],
    "targetPlatforms": [
      {
        "platform": "android",
        "minSdk": 29,
        "abis": [
          "arm64-v8a"
        ]
      },
      {
        "platform": "ios",
        "minOsVersion": "17.0",
        "abis": [
          "arm64"
        ]
      }
    ],
    "streaming": false,
    "notes": "Qwen3 ASR export from Wasser1462/Qwen3-ASR-onnx (GitHub), distributed by the official sherpa-onnx release archive. Load with sherpa-onnx Qwen3 ASR, not individual generic ORT probes. KV budget is runtime-configured; long audio needs bounded segmentation. The pinned implementation does not populate result.lang: no language inference is claimed when empty. Host measurements and limitations live in reports/continuation-grok-asr.md. Draft: device and production quality gates remain unverified."
  },
  "capabilities": {
    "modes": [
      "transcribe"
    ],
    "languages": [],
    "verification": {}
  },
  "files": [
    {
      "path": "asr/conv_frontend.onnx",
      "sizeBytes": 44148281,
      "sha256": "d22dc4423e0940e49884e903d2ea2f7e5567c14fc1aed97e4e26d6b8f208ef9e",
      "classification": "model"
    },
    {
      "path": "asr/encoder.int8.onnx",
      "sizeBytes": 182491662,
      "sha256": "60748d3e6744a57c9c91e1b17424a6c2990567e8adceb0783940c03ed98fa9d9",
      "classification": "model"
    },
    {
      "path": "asr/decoder.int8.onnx",
      "sizeBytes": 755914231,
      "sha256": "4f6885be5959ae26af3089d38ee7972c5fafbeeb1cf8d5e76eab6d8b61ca5771",
      "classification": "model"
    },
    {
      "path": "asr/tokenizer/vocab.json",
      "sizeBytes": 2776833,
      "sha256": "ca10d7e9fb3ed18575dd1e277a2579c16d108e32f27439684afa0e10b1440910",
      "classification": "model"
    },
    {
      "path": "asr/tokenizer/merges.txt",
      "sizeBytes": 1671853,
      "sha256": "8831e4f1a044471340f7c0a83d7bd71306a5b867e95fd870f74d0c5308a904d5",
      "classification": "model"
    },
    {
      "path": "asr/tokenizer/tokenizer_config.json",
      "sizeBytes": 12487,
      "sha256": "4942d005604266809309cabc9f4e9cb89ce855d59b14681fdc0e1cc62ea26c4c",
      "classification": "model"
    }
  ],
  "roles": {
    "conv_frontend": "asr/conv_frontend.onnx",
    "encoder": "asr/encoder.int8.onnx",
    "decoder": "asr/decoder.int8.onnx",
    "tokenizer_vocab": "asr/tokenizer/vocab.json",
    "tokenizer_merges": "asr/tokenizer/merges.txt",
    "tokenizer_config": "asr/tokenizer/tokenizer_config.json"
  }
}
