{
  "schemaVersion": "2",
  "packageId": "mt",
  "version": "0.2.0",
  "status": "draft",
  "source": {
    "repoId": "AngelSlim/Hy-MT1.5-1.8B-1.25bit-GGUF",
    "revision": "1bed36c0a8f5a0eddf77987b02ba66d4c268aca2",
    "upstreamModelId": "AngelSlim/Hy-MT1.5-1.8B-1.25bit",
    "licenseSource": "License.txt in upstream repository"
  },
  "runtime": {
    "backend": "gguf-llama-cpp",
    "apiContractVersion": "1",
    "quantization": "1.25bit-stq",
    "runtimeRevision": null,
    "executionProviders": [
      "cpu"
    ],
    "streaming": false,
    "targetPlatforms": [
      {
        "platform": "android",
        "minSdk": 29,
        "abis": [
          "arm64-v8a"
        ]
      },
      {
        "platform": "ios",
        "minOsVersion": "17.0",
        "abis": [
          "arm64"
        ]
      }
    ],
    "notes": "Requires STQ kernel; enable only after pinned-revision load/generate/cancel tests."
  },
  "capabilities": {
    "modes": [
      "translate"
    ],
    "languages": [
      "zh",
      "en"
    ],
    "verification": {
      "languages": "unverified"
    }
  },
  "files": [
    {
      "path": "mt/model.gguf",
      "sizeBytes": null,
      "sha256": "93e025c93cc082e73a3f142b757623a8b9cf541c020a8013ca4ee669556860ab",
      "classification": "model"
    }
  ],
  "roles": {
    "translator": "mt/model.gguf"
  }
}
